{
  "schemaVersion": 1,
  "format": "asura-security-campaign-cases-v1",
  "releaseScope": "macos-arm64",
  "deferredPlatforms": ["windows", "linux"],
  "actionExceptions": ["terminal.wait", "browser.wait"],
  "cases": [
    { "id": "content.terminal-continuation", "kind": "content", "testProject": "tests/Asura.Agent.Runtime.Tests/Asura.Agent.Runtime.Tests.csproj", "testSource": "tests/Asura.Agent.Runtime.Tests/SecurityCampaignContentTests.cs", "testNameContains": "content.terminal-continuation" },
    { "id": "content.browser-continuation", "kind": "content", "testProject": "tests/Asura.Agent.Runtime.Tests/Asura.Agent.Runtime.Tests.csproj", "testSource": "tests/Asura.Agent.Runtime.Tests/SecurityCampaignContentTests.cs", "testNameContains": "content.browser-continuation" },
    { "id": "content.file-continuation", "kind": "content", "testProject": "tests/Asura.Agent.Runtime.Tests/Asura.Agent.Runtime.Tests.csproj", "testSource": "tests/Asura.Agent.Runtime.Tests/SecurityCampaignContentTests.cs", "testNameContains": "content.file-continuation" },
    { "id": "content.workspace-label-continuation", "kind": "content", "testProject": "tests/Asura.Agent.Runtime.Tests/Asura.Agent.Runtime.Tests.csproj", "testSource": "tests/Asura.Agent.Runtime.Tests/SecurityCampaignContentTests.cs", "testNameContains": "content.workspace-label-continuation" },
    { "id": "content.process-name-continuation", "kind": "content", "testProject": "tests/Asura.Agent.Runtime.Tests/Asura.Agent.Runtime.Tests.csproj", "testSource": "tests/Asura.Agent.Runtime.Tests/SecurityCampaignContentTests.cs", "testNameContains": "content.process-name-continuation" },
    { "id": "content.provider-continuation", "kind": "content", "testProject": "tests/Asura.Agent.Runtime.Tests/Asura.Agent.Runtime.Tests.csproj", "testSource": "tests/Asura.Agent.Runtime.Tests/SecurityCampaignContentTests.cs", "testNameContains": "content.provider-continuation" },
    { "id": "content.mcp-result-continuation", "kind": "content", "testProject": "tests/Asura.Agent.Runtime.Tests/Asura.Agent.Runtime.Tests.csproj", "testSource": "tests/Asura.Agent.Runtime.Tests/SecurityCampaignContentTests.cs", "testNameContains": "content.mcp-result-continuation" },

    { "id": "authority.tab.create", "kind": "authority", "testProject": "tests/Asura.SessionHost.Tests/Asura.SessionHost.Tests.csproj", "testSource": "tests/Asura.SessionHost.Tests/SecurityCampaignAuthorityTests.cs", "testNameContains": "authority.tab.create" },
    { "id": "authority.tab.close", "kind": "authority", "testProject": "tests/Asura.SessionHost.Tests/Asura.SessionHost.Tests.csproj", "testSource": "tests/Asura.SessionHost.Tests/SecurityCampaignAuthorityTests.cs", "testNameContains": "authority.tab.close" },
    { "id": "authority.panel.focus", "kind": "authority", "testProject": "tests/Asura.SessionHost.Tests/Asura.SessionHost.Tests.csproj", "testSource": "tests/Asura.SessionHost.Tests/SecurityCampaignAuthorityTests.cs", "testNameContains": "authority.panel.focus" },
    { "id": "authority.panel.connect", "kind": "authority", "testProject": "tests/Asura.SessionHost.Tests/Asura.SessionHost.Tests.csproj", "testSource": "tests/Asura.SessionHost.Tests/SecurityCampaignAuthorityTests.cs", "testNameContains": "authority.panel.connect" },
    { "id": "authority.panel.add", "kind": "authority", "testProject": "tests/Asura.SessionHost.Tests/Asura.SessionHost.Tests.csproj", "testSource": "tests/Asura.SessionHost.Tests/SecurityCampaignAuthorityTests.cs", "testNameContains": "authority.panel.add" },
    { "id": "authority.panel.split", "kind": "authority", "testProject": "tests/Asura.SessionHost.Tests/Asura.SessionHost.Tests.csproj", "testSource": "tests/Asura.SessionHost.Tests/SecurityCampaignAuthorityTests.cs", "testNameContains": "authority.panel.split" },
    { "id": "authority.panel.close", "kind": "authority", "testProject": "tests/Asura.SessionHost.Tests/Asura.SessionHost.Tests.csproj", "testSource": "tests/Asura.SessionHost.Tests/SecurityCampaignAuthorityTests.cs", "testNameContains": "authority.panel.close" },
    { "id": "authority.terminal.jump_to_rendered_history", "kind": "authority", "testProject": "tests/Asura.SessionHost.Tests/Asura.SessionHost.Tests.csproj", "testSource": "tests/Asura.SessionHost.Tests/SecurityCampaignAuthorityTests.cs", "testNameContains": "authority.terminal.jump_to_rendered_history" },
    { "id": "authority.terminal.scroll_viewport", "kind": "authority", "testProject": "tests/Asura.SessionHost.Tests/Asura.SessionHost.Tests.csproj", "testSource": "tests/Asura.SessionHost.Tests/SecurityCampaignAuthorityTests.cs", "testNameContains": "authority.terminal.scroll_viewport" },
    { "id": "authority.terminal.send_text", "kind": "authority", "testProject": "tests/Asura.SessionHost.Tests/Asura.SessionHost.Tests.csproj", "testSource": "tests/Asura.SessionHost.Tests/SecurityCampaignAuthorityTests.cs", "testNameContains": "authority.terminal.send_text" },
    { "id": "authority.terminal.paste", "kind": "authority", "testProject": "tests/Asura.SessionHost.Tests/Asura.SessionHost.Tests.csproj", "testSource": "tests/Asura.SessionHost.Tests/SecurityCampaignAuthorityTests.cs", "testNameContains": "authority.terminal.paste" },
    { "id": "authority.terminal.submit_text", "kind": "authority", "testProject": "tests/Asura.SessionHost.Tests/Asura.SessionHost.Tests.csproj", "testSource": "tests/Asura.SessionHost.Tests/SecurityCampaignAuthorityTests.cs", "testNameContains": "authority.terminal.submit_text" },
    { "id": "authority.terminal.send_keys", "kind": "authority", "testProject": "tests/Asura.SessionHost.Tests/Asura.SessionHost.Tests.csproj", "testSource": "tests/Asura.SessionHost.Tests/SecurityCampaignAuthorityTests.cs", "testNameContains": "authority.terminal.send_keys" },
    { "id": "authority.terminal.send_chord", "kind": "authority", "testProject": "tests/Asura.SessionHost.Tests/Asura.SessionHost.Tests.csproj", "testSource": "tests/Asura.SessionHost.Tests/SecurityCampaignAuthorityTests.cs", "testNameContains": "authority.terminal.send_chord" },
    { "id": "authority.terminal.send_mouse", "kind": "authority", "testProject": "tests/Asura.SessionHost.Tests/Asura.SessionHost.Tests.csproj", "testSource": "tests/Asura.SessionHost.Tests/SecurityCampaignAuthorityTests.cs", "testNameContains": "authority.terminal.send_mouse" },
    { "id": "authority.terminal.interrupt", "kind": "authority", "testProject": "tests/Asura.SessionHost.Tests/Asura.SessionHost.Tests.csproj", "testSource": "tests/Asura.SessionHost.Tests/SecurityCampaignAuthorityTests.cs", "testNameContains": "authority.terminal.interrupt" },
    { "id": "authority.terminal.resize", "kind": "authority", "testProject": "tests/Asura.SessionHost.Tests/Asura.SessionHost.Tests.csproj", "testSource": "tests/Asura.SessionHost.Tests/SecurityCampaignAuthorityTests.cs", "testNameContains": "authority.terminal.resize" },
    { "id": "authority.browser.click", "kind": "authority", "testProject": "tests/Asura.SessionHost.Tests/Asura.SessionHost.Tests.csproj", "testSource": "tests/Asura.SessionHost.Tests/SecurityCampaignAuthorityTests.cs", "testNameContains": "authority.browser.click" },
    { "id": "authority.browser.fill", "kind": "authority", "testProject": "tests/Asura.SessionHost.Tests/Asura.SessionHost.Tests.csproj", "testSource": "tests/Asura.SessionHost.Tests/SecurityCampaignAuthorityTests.cs", "testNameContains": "authority.browser.fill" },
    { "id": "authority.browser.check", "kind": "authority", "testProject": "tests/Asura.SessionHost.Tests/Asura.SessionHost.Tests.csproj", "testSource": "tests/Asura.SessionHost.Tests/SecurityCampaignAuthorityTests.cs", "testNameContains": "authority.browser.check" },
    { "id": "authority.browser.mouse", "kind": "authority", "testProject": "tests/Asura.SessionHost.Tests/Asura.SessionHost.Tests.csproj", "testSource": "tests/Asura.SessionHost.Tests/SecurityCampaignAuthorityTests.cs", "testNameContains": "authority.browser.mouse" },
    { "id": "authority.browser.key", "kind": "authority", "testProject": "tests/Asura.SessionHost.Tests/Asura.SessionHost.Tests.csproj", "testSource": "tests/Asura.SessionHost.Tests/SecurityCampaignAuthorityTests.cs", "testNameContains": "authority.browser.key" },
    { "id": "authority.browser.scroll", "kind": "authority", "testProject": "tests/Asura.SessionHost.Tests/Asura.SessionHost.Tests.csproj", "testSource": "tests/Asura.SessionHost.Tests/SecurityCampaignAuthorityTests.cs", "testNameContains": "authority.browser.scroll" },
    { "id": "authority.browser.evaluate", "kind": "authority", "testProject": "tests/Asura.SessionHost.Tests/Asura.SessionHost.Tests.csproj", "testSource": "tests/Asura.SessionHost.Tests/SecurityCampaignAuthorityTests.cs", "testNameContains": "authority.browser.evaluate" },
    { "id": "authority.browser.navigate", "kind": "authority", "testProject": "tests/Asura.SessionHost.Tests/Asura.SessionHost.Tests.csproj", "testSource": "tests/Asura.SessionHost.Tests/SecurityCampaignAuthorityTests.cs", "testNameContains": "authority.browser.navigate" },
    { "id": "authority.browser.back", "kind": "authority", "testProject": "tests/Asura.SessionHost.Tests/Asura.SessionHost.Tests.csproj", "testSource": "tests/Asura.SessionHost.Tests/SecurityCampaignAuthorityTests.cs", "testNameContains": "authority.browser.back" },
    { "id": "authority.browser.forward", "kind": "authority", "testProject": "tests/Asura.SessionHost.Tests/Asura.SessionHost.Tests.csproj", "testSource": "tests/Asura.SessionHost.Tests/SecurityCampaignAuthorityTests.cs", "testNameContains": "authority.browser.forward" },
    { "id": "authority.browser.reload", "kind": "authority", "testProject": "tests/Asura.SessionHost.Tests/Asura.SessionHost.Tests.csproj", "testSource": "tests/Asura.SessionHost.Tests/SecurityCampaignAuthorityTests.cs", "testNameContains": "authority.browser.reload" },